text asli,text_prepro,compound scores,Sentimen
mau daftar susah padahal data pribadi benar tidak diterima tidak aplikasi sebelahnya mudah didaftarkan,mau daftar susah padahal data pribadi benar tidak terima tidak aplikasi belah mudah daftar,-15,Negatif
aplikasi reksa dana fitur lengkap bagus sederhana mudah dipahami sangat membantu dalam memulai berinvestasi semoga bermanfaat kita semua,aplikasi reksa dana fitur lengkap bagus sederhana mudah paham sangat bantu dalam mulai investasi moga manfaat kita semua,27,Positif
sebenarnya keseluruhan rata rata bagus sayangnya masa tunggu pembelian unit penjualan unit penarikan rekening bank memakan waktu lama berhari hari bahkan baru terisi topup hari menarik dana rekening lama banget hari mohon waktu tunggunya diperbaiki perbedaan hari menentukan harga beli jual unit reksa dana,benar seluruh rata rata bagus sayang masa tunggu beli unit jual unit tari rekening bank makan waktu lama hari hari bahkan baru isi topup hari tarik dana rekening lama banget hari mohon waktu tunggu baik beda hari tentu harga beli jual unit reksa dana,-5,Negatif
terima kasih bareksa tampilannya sekarang lebih bagus bisa bayar pakai ovo kalau saran lebih baik ada keamanan tambahan login menggunakan sidik jari tampilan mode gelap terima kasih atas perhatiannya kerja bagus,terima kasih bareksa tampil sekarang lebih bagus bisa bayar pakai ovo kalau saran lebih baik ada aman tambah login guna sidik jari tampil mode gelap terima kasih atas perhati kerja bagus,23,Positif
senang sekali berinvestasi disini sedikit saran kita menyediakan fitur ahli waris sewaktu waktu kita meninggal notifikasi dikirimkan email nomor ahli waris ditunjuk soalnya disebelahnya appkalau ada saya tambah bintangnya jadi,senang sekali investasi sini sedikit saran kita sedia fitur ahli waris waktu waktu kita tinggal notifikasi kirim email nomor ahli waris tunjuk soal belah appkalau ada saya tambah bintang jadi,13,Positif
melakukan pembelian terasa cepat hanya membutuhkan waktu beberapa hari saat melakukan penjualan lama sekali malah butuh seminggu lebih nunggu cari dana pertama coba kalau pelayanannya begini mendingan pindah aplikasi,laku beli asa cepat hanya butuh waktu beberapa hari saat laku jual lama sekali malah butuh minggu lebih nunggu cari dana pertama coba kalau layan begini mending pindah aplikasi,-23,Negatif
sejak zaman kuno memenuhi persyaratan sampai ini diterima oke pindah tempat lebih ramah sebelah salah satu aplikasi rd terlaris,sejak zaman kuno penuh syarat sampai ini terima oke pindah tempat lebih ramah belah salah satu aplikasi rd laris,-5,Negatif
cepat mudah digunakan tingkatkan kemampuan analisabareksa pakai menabung reksa dana sedikit sedikit menjadi gunung,cepat mudah guna tingkat mampu analisabareksa pakai tabung reksa dana sedikit sedikit jadi gunung,16,Positif
sudah lama bermain bareksa mengenal bareksa sejak sama segi performa keamanan mantap customer service ramah sekarang bareksa makin menarik terima kasih bareksa tingkatkan terus performa bagusnya,sudah lama main bareksa kenal bareksa sejak sama segi performa aman mantap customer service ramah sekarang bareksa makin tarik terima kasih bareksa tingkat terus performa bagus,28,Positif
aplikasinya mengalahkan bibit sudah memiliki juta pengguna bareksa sekarang baru punya juta pengguna jualtukar produk gratis bibit minimal promo gratis x transaksibulan hapus mode pembayaran transfer manual banyak kejadian melalui proses kurang efisien memperbanyak kolaborasi dompet digital ada linkaja ovo bisa pakai gopay shopeepaydana dan lain,aplikasi kalah bibit sudah milik juta guna bareksa sekarang baru punya juta guna jualtukar produk gratis bibit minimal promo gratis x transaksibulan hapus mode bayar transfer manual banyak jadi lalu proses kurang efisien banyak kolaborasi dompet digital ada linkaja ovo bisa pakai gopay shopeepaydana dan lain,21,Positif
aplikasinya mudah dicoba csnya cepat tanggap memudahkan mudahmudahan masalah penarikan dana meski terkadang membaca ada beberapa keluhan,aplikasi mudah coba csnya cepat tanggap mudah mudahmudahan masalah tari dana meski terkadang baca ada beberapa keluh,18,Positif
min mau lapor mau daftar isi data diri combo boxnya berfungsi min satupun pilihan muncul saya baru install aplikasinya min ada ada solusinya min,min mau lapor mau daftar isi data diri combo boxnya fungsi min satu pilih muncul saya baru install aplikasi min ada ada solusi min,17,Positif
tidak transaksi sangat mudah membuka aplikasi ada transaksi sangat sulit membuka aplikasi jadi ragu aplikasi mohon admin memberikan penjelasannya,tidak transaksi sangat mudah buka aplikasi ada transaksi sangat sulit buka aplikasi jadi ragu aplikasi mohon admin beri jelas,14,Positif
pertama kali mendownloadnya percaya takut tidak aman setelah mendaftar menggunakannya sangat bersyukur bertemu aplikasi dengan berinvestasi bareksa sangat mudah sederhana buruan download kecewa,pertama kali mendownloadnya percaya takut tidak aman telah daftar guna sangat syukur temu aplikasi dengan investasi bareksa sangat mudah sederhana buru download kecewa,9,Positif
min tambahkan fitur kunci membuka aplikasi harus memasukkan pin terlebih hanya lebih aman juga menggunakan aplikasi tetangga dan sangat nyaman merasa aman terima kasih saya harap membaca ulasan,min tambah fitur kunci buka aplikasi harus masuk pin lebih hanya lebih aman juga guna aplikasi tetangga dan sangat nyaman rasa aman terima kasih saya harap baca ulas,14,Positif
aplikasinya bagus sekedar saran tambahkan kode keamanan tokopedia ovo seperti mbanking bentuk pin soalnya menyangkut uang jadi seseorang terkena dampak kecelakaan kehilangan ponselnya perlu khawatir,aplikasi bagus dar saran tambah kode aman tokopedia ovo seperti mbanking bentuk pin soal sangkut uang jadi orang kena dampak celaka hilang ponselnya perlu khawatir,7,Positif
sebenarnya informasinya lengkap banget saja proses transaksinya lama sampai jam mulai jual beli bisa dilakukan hari sama,benar informasi lengkap banget saja proses transaksi lama sampai jam mulai jual beli bisa laku hari sama,5,Positif
fitur lupa password berfungsi tidak login password baru padahal sebelumnya berhasil mengganti password menggunakan fitur lupa password dimohon perhatiannya,fitur lupa password fungsi tidak login password baru padahal belum hasil ganti password guna fitur lupa password mohon perhati,-1,Negatif
aplikasi cocok belajar reksa dana sistem transaksi sepenuhnya online beragam produk lebih mi memberikan lebih banyak pilihan berinvestasi dibandingkan aperd lainnya minimal investasinya dimulai ribu sangat berguna generasi muda mulai belajar investasi reksa dana kerja bagus bareksa,aplikasi cocok ajar reksa dana sistem transaksi sepenuh online agam produk lebih mi beri lebih banyak pilih investasi banding aperd lain minimal investasi mulai ribu sangat guna generasi muda mulai ajar investasi reksa dana kerja bagus bareksa,30,Positif
beli reksa dana campuran harganya turun terus proses hari padahal belinya jam setengah belinya harga turun malah naik harganya lalu jam harganya turunauto losskalo beli dikit masalahsaya beli jtauto losstolong pak kalau beli jam kerja mohon segera diprosesminimal jam hari proses selesai,beli reksa dana campur harga turun terus proses hari padahal beli jam tengah beli harga turun malah naik harga lalu jam harga turunauto losskalo beli dikit masalahsaya beli jtauto losstolong pak kalau beli jam kerja mohon segera diprosesminimal jam hari proses selesai,18,Positif
aplikasinya mudah pahami semuanya cek aplikasi dan ada pembagiannya lebih sederhana mudah di pahami user,aplikasi mudah paham semua cek aplikasi dan ada bagi lebih sederhana mudah di paham user,3,Positif
sedikit masukan proses penjualan boleh asal diproses selesai setelah pengguna mengira uang masuk rekening ada proses berjalan dikirim platform,sedikit masuk proses jual boleh asal proses selesai telah guna ira uang masuk rekening ada proses jalan kirim platform,3,Positif
memiliki platform aplikasi reksa dana bareksa instrumen reksa dananya sama produk reksa dananya sama penjual aset reksa dananya sama nilai investasinya sama berbeda nilai keuntungan diperoleh bareksa penghasilan sangat kecil dapatkan platform yang gunakan semoga tim bareksa menjawabnya,milik platform aplikasi reksa dana bareksa instrumen reksa dana sama produk reksa dana sama jual aset reksa dana sama nilai investasi sama beda nilai untung oleh bareksa hasil sangat kecil dapat platform yang guna moga tim bareksa jawab,56,Positif
ekh gimana caranya upload bukti pembayaran malah kembali menu awal pilih pembayaran jadi tidak memastikannya jangan kehilangan uangku jawab csnya,ekh gimana cara upload bukti bayar malah kembali menu awal pilih bayar jadi tidak pasti jangan hilang uang jawab csnya,-8,Negatif
lebih leluasa jual beli waktu pengerjaan terlalu lama merasa bingung harga jual belinya kalau prosesnya selesai hari kerja lebih fleksibel,lebih leluasa jual beli waktu kerja terlalu lama rasa bingung harga jual beli kalau proses selesai hari kerja lebih fleksibel,-4,Negatif
transfer virtual account sekarang biaya pembayarannya wkwk kalau dulu grafis hariannya update sekarang ada tapi ikuti seed dukungan csnya ngobrol robot jadi lebih lama bukannya memberi inovasi malah tertinggal seed tarik semua dana pergi benih,transfer virtual account sekarang biaya bayar wkwk kalau dulu grafis hari update sekarang ada tapi ikut seed dukung csnya ngobrol robot jadi lebih lama bukan beri inovasi malah tinggal seed tarik semua dana pergi benih,1,Positif
sudah daftar akun lebih kali kendalanya ada saya masukkan nama banknya mungkin perlu diupdate versinya ternyata diupdate kesulitannya sama memasukkan nama banknya mohon bantuannya,sudah daftar akun lebih kali kendala ada saya masuk nama bank mungkin perlu diupdate versi nyata diupdate sulit sama masuk nama bank mohon bantu,5,Positif
mendaftar ovo invest bukareksa mendaftar bareksa sudah mengganti ponsel sudah mendapatkan aplikasi terbaru tetap tidak bisa mendaftar sudah menghubungi customer service bareksa saya kurang kompeten jangan pakai aplikasi ribet mau investasi buka rekening susah beda kompetitor,daftar ovo invest bukareksa daftar bareksa sudah ganti ponsel sudah dapat aplikasi baru tetap tidak bisa daftar sudah hubung customer service bareksa saya kurang kompeten jangan pakai aplikasi ribet mau investasi buka rekening susah beda kompetitor,-4,Negatif
saat daftar akun baru masuk tahap masukkan nomor rekening selalu gagal padahal nomor rekening sesuai nama lengkap,saat daftar akun baru masuk tahap masuk nomor rekening selalu gagal padahal nomor rekening sesuai nama lengkap,-8,Negatif
sudah mendaftar bareksa sebelumnya belum menyelesaikannya sekarang tidak melanjutkan tanya customer service malah disuruh kirim wa ktp takut disalah gunakan lebih baik gunakan aplikasi teman bilang benih sangat bagus,sudah daftar bareksa belum belum selesai sekarang tidak lanjut tanya customer service malah suruh kirim wa ktp takut salah guna lebih baik guna aplikasi teman bilang benih sangat bagus,-3,Negatif
tempat pendaftarannya banyak prosedurnya lancar di bareksa pendaftarannya banyak prosedurnya sistemnya kurang bagus seminggu akun terbengkalai terverifikasi sepertinya aplikasinya error terus iya banyak ngerti prosedurnya peraturan ojk di aplikasi bareksa hmm entahlah,tempat daftar banyak prosedur lancar di bareksa daftar banyak prosedur sistem kurang bagus minggu akun bengkalai verifikasi seperti aplikasi error terus iya banyak ngerti prosedur atur ojk di aplikasi bareksa hmm entah,-16,Negatif
mudah digunakan anda menggunakan aplikasi menjelaskannya terlebih anda mengetahui fungsifungsi ada dalam aplikasi segi ui ux artinya sangat bagus,mudah guna anda guna aplikasi jelas lebih anda tahu fungsifungsi ada dalam aplikasi segi ui ux arti sangat bagus,11,Positif
proses verifikasi pembayaran memakan waktu sangat lama sayang sekali walaupun melakukan deposit bareksa membutuhkan waktu sangat lama melakukan verifikasi mengecewakan,proses verifikasi bayar makan waktu sangat lama sayang sekali walaupun laku deposit bareksa butuh waktu sangat lama laku verifikasi kecewa,-14,Negatif
aplikasi bareksa kok bisa dibuka padahal uninstall lalu install tapi tetap bisa dibuka apa solusinya,aplikasi bareksa kok bisa buka padahal uninstall lalu install tapi tetap bisa buka apa solusi,-3,Negatif
sayang tim bareksa kemarin mendaftar awalnya disetujui mengunggah foto kepemilikan akun dianggap tidak jelas kemarin disuruh upload alamat csbareksa setelah email ada jawaban sekarang mohon bantuannya bagaimana cara upload ulang bukti kepemilikan akun saya,sayang tim bareksa kemarin daftar awal tuju unggah foto milik akun anggap tidak jelas kemarin suruh upload alamat csbareksa telah email ada jawab sekarang mohon bantu bagaimana cara upload ulang bukti milik akun saya,4,Positif
bagus mudah dimengerti harap seringsering force close membuka simulasi harap melakukan verifikasi otomatis pelanggan mentransfer sejumlah uang mohon dipercepat pencairannya tidak lebih hari selebihnya bagus mulus baik baik,bagus mudah erti harap seringsering force close buka simulasi harap laku verifikasi otomatis langgan transfer jumlah uang mohon cepat cair tidak lebih hari lebih bagus mulus baik baik,30,Positif
aplikasinya aneh sekali daftar berhasil ikuti langkahlangkahnya lalu sengaja logout bareksa lalu login lari jadi tidak bisa padahal password usernamenya benar sekali katanya salah aplikasinya aneh banget jadi tidak yakin,aplikasi aneh sekali daftar hasil ikut langkahlangkahnya lalu sengaja logout bareksa lalu login lari jadi tidak bisa padahal password usernamenya benar sekali kata salah aplikasi aneh banget jadi tidak yakin,-13,Negatif
aplikasinya bagus kekurangannya tidak pembayaran melalui dompet digital dana linkage gopay ditambah akan lebih menggiurkan investor pemula,aplikasi bagus kurang tidak bayar lalu dompet digital dana linkage gopay tambah akan lebih giur investor mula,0,Positif
harga sekarang telat update sehari tentunya terus kalau mau beli mau beli harganya berapa nah kalau dilihat harga hari sebelumnya bisa diperbarui real time sesuai hari,harga sekarang telat update hari tentu terus kalau mau beli mau beli harga berapa nah kalau lihat harga hari belum bisa baru real time sesuai hari,7,Positif
pengalaman menggunakan bareksa bulan aplikasi bagus banget pilihan reksa dana sangat bervariatif customer servicenya cepat menangani permasalahan kekurangannya pada cara pembayaran kurang coba menambahkan link gopay bank bca lebih baik bersaing pasar semoga saran dibaca direalisasikan reksa dana lainnya,alam guna bareksa bulan aplikasi bagus banget pilih reksa dana sangat variatif customer servicenya cepat tangan masalah kurang pada cara bayar kurang coba tambah link gopay bank bca lebih baik saing pasar moga saran baca realisasi reksa dana lain,18,Positif
customer service sistem informasinya kurang jelas disuruh koreksi data upload ulang foto selfie tidak fitur upload foto,customer service sistem informasi kurang jelas suruh koreksi data upload ulang foto selfie tidak fitur upload foto,-11,Negatif
aplikasi sangat dipercaya ojk jujur loginnya sering crash plus minusnya ketika update bareksa aplikasi membutuhkan pengorbanan ram,aplikasi sangat percaya ojk jujur loginnya sering crash plus minus ketika update bareksa aplikasi butuh korban ram,-10,Negatif
memberikan bintang merasa cukup puas kinerja aplikasi padahal baru pertama kali melakukan transaksi bareksa pembeliannya terverifikasi metode pembayaran menggunakan ovo transfer bank bca transfer dilakukan melalui aplikasi flip semoga kedepannya pendistribusian produk bukareksa mempercepat verifikasi kepemilikan unit terima kasih kedepannya ditingkatkan dimaksimalkan banyak orang bergabung bareksa,beri bintang rasa cukup puas kerja aplikasi padahal baru pertama kali laku transaksi bareksa beli verifikasi metode bayar guna ovo transfer bank bca transfer laku lalu aplikasi flip moga depan distribusi produk bukareksa cepat verifikasi milik unit terima kasih depan tingkat maksimal banyak orang gabung bareksa,13,Positif
mau tarik dana gagal terus coba tambah nomor rekening beda bank tetap bisa sudah update aplikasi berhasil koneksi internet lancar ada solusinya,mau tarik dana gagal terus coba tambah nomor rekening beda bank tetap bisa sudah update aplikasi hasil koneksi internet lancar ada solusi,28,Positif
telah mendaftar mengaktifkan akun email tapi pas masuk aplikasi tidak di lanjutkan kata sandi email salah selalu itu mohon ditindak lanjuti kenyamanan bersama,telah daftar aktif akun email tapi pas masuk aplikasi tidak di lanjut kata sandi email salah selalu itu mohon tindak lanjut nyaman sama,-3,Negatif
platform investasi paling mudah dipahami orang awam saya sudah menggunakan bareksa selama bulan alhamdulillah pernah masalah bareksa,platform investasi paling mudah paham orang awam saya sudah guna bareksa lama bulan alhamdulillah pernah masalah bareksa,-2,Negatif
kalau bisa support pembayaran lewat ovo disarankan pakai ovo apa membeli produk reksa dana fix income hari lalu saat saldo masih mengecewakan proses transaksinya lebih hari,kalau bisa support bayar lewat ovo saran pakai ovo apa beli produk reksa dana fix income hari lalu saat saldo masih kecewa proses transaksi lebih hari,4,Positif
sebenarnya bagus sayangnya transfer bank manual malah berakhir transfer bca juga membukanya transfer bank seperti bri ingin akun virtual dikenakan biaya kalau masalah sudah diperbaiki saya akan menambahkannya menjadi bintang,benar bagus sayang transfer bank manual malah akhir transfer bca juga buka transfer bank seperti bri ingin akun virtual kena biaya kalau masalah sudah baik saya akan tambah jadi bintang,4,Positif
sudah menerima trial deposit ribu bni pada hari keempat diproses padahal sudah membaca peraturan hari kerja sampai diproses terus menerus bagaimana aplikasi bareksa benar tidak ini yang asli mohon diperbaiki konsumen puas,sudah terima trial deposit ribu bni pada hari empat proses padahal sudah baca atur hari kerja sampai proses terus terus bagaimana aplikasi bareksa benar tidak ini yang asli mohon baik konsumen puas,6,Positif
selamat siang melakukan pemesanan reksa dana sudah transfer mendapat status pemesanan disetujui pada sub menu portofolio terlihat nilai tabungan saya masih rupiah mohon penjelasannya,selamat siang laku mesan reksa dana sudah transfer dapat status mesan tuju pada sub menu portofolio lihat nilai tabung saya masih rupiah mohon jelas,25,Positif
aplikasi investasi reksa dana ramah pengguna tampilan wajahnya tertata rapi juga berinvestasi nominal kecil cukup rupiah ribu bahkan produk dibeli mulai rupiah ribu kekurangannya perolehan unit investasi membutuhkan waktu cukup lama sejak pembelian produk belinya mudah bisa pakai ovo pilihan investasinya banyak beragam mulai pasar uang hingga saham baeksa sangat suka berinvestasi reksa dana,aplikasi investasi reksa dana ramah guna tampil wajah tata rapi juga investasi nominal kecil cukup rupiah ribu bahkan produk beli mulai rupiah ribu kurang oleh unit investasi butuh waktu cukup lama sejak beli produk beli mudah bisa pakai ovo pilih investasi banyak agam mulai pasar uang hingga saham baeksa sangat suka investasi reksa dana,39,Positif
belum sebagus aplikasi berikutnya terkadang gangguan dana portofolio terkadang berubah tidak tepat,belum bagus aplikasi ikut terkadang ganggu dana portofolio terkadang ubah tidak tepat,-5,Negatif
sangat suka aplikasi bareksa lebih mudah berinvestasi ribet sedikit pertanyaan setelah pembayaran selesai status investasi tidak langsung masuk masih proses mungkinkah aplikasi atau semua produk investasi mana perlakuannya ini karena ini pengalaman pertama investasi saham lewat bareksa biasanya saya investasi pasar uang binomo,sangat suka aplikasi bareksa lebih mudah investasi ribet sedikit tanya telah bayar selesai status investasi tidak langsung masuk masih proses mungkin aplikasi atau semua produk investasi mana laku ini karena ini alam pertama investasi saham lewat bareksa biasa saya investasi pasar uang binomo,-11,Negatif
aplikasi reksa dana merupakan aplikasi cocok pemula ingin belajar berinvestasi modal kecil bisa menabung bulannya aplikasi paling direkomendasikan,aplikasi reksa dana rupa aplikasi cocok mula ingin ajar investasi modal kecil bisa tabung bulan aplikasi paling rekomendasi,2,Positif
ingin mengajukan perubahan data akun namun kirimkan email layanan pelanggan emailnya tertulis antrian padahal sebelumnya dan saya coba menggunakan email namun hasilnya tetap sama mohon direspon,ingin aju ubah data akun namun kirim email layan langgan email tulis antri padahal belum dan saya coba guna email namun hasil tetap sama mohon direspon,4,Positif
cukup pakai bareksa mending beralih bibit kalau beli reksa dana biayanya kalau lama beli sbn dinonaktifkan harus diaktifkan yang bikin ribet pindah platform,cukup pakai bareksa mending alih bibit kalau beli reksa dana biaya kalau lama beli sbn nonaktif harus aktif yang bikin ribet pindah platform,-9,Negatif
proses pembelian produk reksa dana memakan waktu sangat lama hampir hari namun ada penambahan rekening reksa dana mungkin anda menjualnya itu berharap kedepannya prosesnya memakan waktu hari hingga selesai,proses beli produk reksa dana makan waktu sangat lama hampir hari namun ada tambah rekening reksa dana mungkin anda jual itu harap depan proses makan waktu hari hingga selesai,20,Positif
sudah kirim email menambah akun sejak september sampai sekarang ada balasan lebih mudah menambahkan akun perlu repot email,sudah kirim email tambah akun sejak september sampai sekarang ada balas lebih mudah tambah akun perlu repot email,20,Positif
aplikasi nyaman digunakan saran menambahkan fitur trend chart harga porto sehingga dapat melihat fluktuasinya hari terima kasih,aplikasi nyaman guna saran tambah fitur trend chart harga porto sehingga dapat lihat fluktuasi hari terima kasih,15,Positif
tepat tahun menggunakan aplikasi baik pemula hingga tingkat menengah seterusnya pelayanan customer service lewat wa fast respon ramah solusi,tepat tahun guna aplikasi baik mula hingga tingkat tengah terus layan customer service lewat wa fast respon ramah solusi,14,Positif
menjual efek sulit rumit ketika chatting customer service bahasa digunakan bahasa template bertele tele rdn binaartha dibuka pembukaan rdn ini statusnya aktif menghubungi binaartha sekuritas binaartha malah diminta menghubungi customer service bareksa setelah customer service bareksa hasilnya belum dicairkan sekarang kecewa sr st tetap dalam portofolio saya,jual efek sulit rumit ketika chatting customer service bahasa guna bahasa template tele tele rdn binaartha buka buka rdn ini status aktif hubung binaartha sekuritas binaartha malah minta hubung customer service bareksa telah customer service bareksa hasil belum cair sekarang kecewa sr st tetap dalam portofolio saya,-15,Negatif
aplikasi kelihatannya mudah daftarnya susah banget buat selfie selfie malah bisa diterima akun foto jelas lurus pakai topi masker jangan tidak memakai kacamata menyebalkan,aplikasi lihat mudah daftar susah banget buat selfie selfie malah bisa terima akun foto jelas lurus pakai topi masker jangan tidak pakai kacamata sebal,3,Positif
sebenarnya apa apa saja sayang penjualan produk memakan waktu sangat lama berbeda bibit sangat cepat proses pencairan penjualannya mohon bantuannya ditingkatkan,benar apa apa saja sayang jual produk makan waktu sangat lama beda bibit sangat cepat proses cair jual mohon bantu tingkat,2,Positif
mau edit profil aplikasi tiba tiba close admin diupdate aplikasinya tutup terus kalau nanti tambah bintangnya,mau edit profil aplikasi tiba tiba close admin diupdate aplikasi tutup terus kalau nanti tambah bintang,-14,Negatif
mohon diperbaiki uiuxnya bagus uiuxnya produknya lebih lengkap dibandingkan bareksa,mohon baik uiuxnya bagus uiuxnya produk lebih lengkap banding bareksa,16,Positif
menerima konfirmasi nomor handphone email membutuhkan waktu sangat lama sudah menunggu hampir hari sejak mendaftar aplikasi namun ada tanggapan melalui email memeriksa email spam tidak muncul min mohon ijinkan aplikasi,terima konfirmasi nomor handphone email butuh waktu sangat lama sudah tunggu hampir hari sejak daftar aplikasi namun ada tanggap lalu email periksa email spam tidak muncul min mohon ijinkan aplikasi,-12,Negatif
edit pin sekarang bisa digunakan sidik jarinya belum edit semuanya sempurna terima kasih bareksa,edit pin sekarang bisa guna sidik jari belum edit semua sempurna terima kasih bareksa,-2,Negatif
kalau produk mutual memang juara pilihannya banyak aplikasi sejenis ber isbn banyak hilang hanyalah emas kripto asuransi investasi sangat mudah menyelesaikannya cepat,kalau produk mutual memang juara pilih banyak aplikasi jenis ber isbn banyak hilang hanya emas kripto asuransi investasi sangat mudah selesai cepat,16,Positif
baru mendownloadnya belum pernah mendownloadnya mendaftar bareksa hanya mencobanya pertama kali anehnya pas daftar nomor ktp nya terdaftar kokaneh banget ajaib banget,baru mendownloadnya belum pernah mendownloadnya daftar bareksa hanya coba pertama kali aneh pas daftar nomor ktp nya daftar kokaneh banget ajaib banget,4,Positif
sejauh bareksa sangat memuaskan baru update aplikasi bareksa pas mau edit profil rekening bank saya gagal terus terima kasih atas bantuannya,jauh bareksa sangat muas baru update aplikasi bareksa pas mau edit profil rekening bank saya gagal terus terima kasih atas bantu,5,Positif
