text asli,text_prepro,compound scores,Sentimen
menyelesaikan transaksi dimohon jangan terlalu lama akan mempengaruhi harga beliunit terima kasih,selesai transaksi mohon jangan terlalu lama akan pengaruh harga beliunit terima kasih,7,Positif
dear admin silahkan menu portofolio klik nama reksa dananya anda bisa masuk reksa dana kedua mudah memantau pergerakannya versi sebelumnya terima kasih,dear admin silah menu portofolio klik nama reksa dana anda bisa masuk reksa dana dua mudah pantau gera versi belum terima kasih,25,Positif
transaksi menggunakan tautan tidak dilakukan dikatakan jaringan ada selama berhari hari jaringan aman,transaksi guna taut tidak laku kata jaring ada lama hari hari jaring aman,5,Positif
cara penggunaannya sangat mudah prosesnya mudah jadi sekarang lebih melek investasi bagus,cara guna sangat mudah proses mudah jadi sekarang lebih melek investasi bagus,19,Positif
sejauh aplikasinya sangat bagus ingin mencari solusinya konsultasi kontak person bareksabisa lewat wa,jauh aplikasi sangat bagus ingin cari solusi konsultasi kontak person bareksabisa lewat wa,5,Positif
selama bareksa nyaman kebetulan customer service bareksa cepat tanggap memberikan solusi,lama bareksa nyaman betul customer service bareksa cepat tanggap beri solusi,12,Positif
ternyata game membuat kaya mendadak akan memainkan game selamanya yuk mainkan game menghasilkan uang besar semua permainan berguna untuk membuat kaya,nyata game buat kaya dadak akan main game lama yuk main game hasil uang besar semua main guna untuk buat kaya,29,Positif
rekomendasi yang berinvestasi jangka panjang pendek sistem keuntungan keamanan sangat baik,rekomendasi yang investasi jangka panjang pendek sistem untung aman sangat baik,11,Positif
selamat berinvestasi bareksa keuntungannya besar tersedia produk reksa dana portofolio sangat bagus tersedia jangka pendek jangka panjang,selamat investasi bareksa untung besar sedia produk reksa dana portofolio sangat bagus sedia jangka pendek jangka panjang,42,Positif
aplikasi bareksa sangat user friendly informatifterus tingkatkansemoga sukses tim bareksa,aplikasi bareksa sangat user friendly informatifterus tingkatkansemoga sukses tim bareksa,-2,Negatif
aplikasi investasi keren cuma pembelian rekeningnya cukup lama keseluruhan bagus direkomendasikan,aplikasi investasi keren cuma beli rekening cukup lama seluruh bagus rekomendasi,-4,Negatif
kalau penjualan reksa dana ada konfirmasi melalui email hasil penjualan ditransfer untuk memudahkan mengecek dana diterima belum terima kasih,kalau jual reksa dana ada konfirmasi lalu email hasil jual transfer untuk mudah ecek dana terima belum terima kasih,31,Positif
mulailah belajar investasi reksa dana pilih aplikasi bareksa kemarin sedikit kendala customer service bareksa sangat membantu mengatasi permasalahan terjadi dalam menyampaikan informasi sangat jelas baik tetap semangat terima kasih,mulai ajar investasi reksa dana pilih aplikasi bareksa kemarin sedikit kendala customer service bareksa sangat bantu atas masalah jadi dalam sampai informasi sangat jelas baik tetap semangat terima kasih,19,Positif
login lewat browser aplikasi bilang password salah padahal penulisannya benar coba reset password tetap bisa login passwordnya terus salah,login lewat browser aplikasi bilang password salah padahal tulis benar coba reset password tetap bisa login passwordnya terus salah,-7,Negatif
akhirakhir setiap mau buka pembayaran bareksa emas lewat transfer bank selalu error juga coba install ulang error tetap terjadi,akhirakhir tiap mau buka bayar bareksa emas lewat transfer bank selalu error juga coba install ulang error tetap jadi,2,Positif
fiturnya sangat mudah digunakan semoga kedepannya fitur auto debit memudahkan berinvestasi,fiturnya sangat mudah guna moga depan fitur auto debit mudah investasi,13,Positif
aplikasi investasi reksadananya bagus pilihan reksa dana lengkap banyak banyak promosi,aplikasi investasi reksadananya bagus pilih reksa dana lengkap banyak banyak promosi,11,Positif
pokoknya paling bagus responnya selalu cepat terjaga suka fiturnya memudahkan mendapatkan informasi jadi terima kasih,pokok paling bagus responnya selalu cepat jaga suka fiturnya mudah dapat informasi jadi terima kasih,24,Positif
baiknya usahakan pembayaran menggunakan virtual account tidak perlu konfirmasi manual,baik usaha bayar guna virtual account tidak perlu konfirmasi manual,6,Positif
bahkan bisa mengunggah ktp selalu error scan muncul bagaimana investasi pasar uang langsung hilang aplikasi tolol lebih baik pakai seeds indogold,bahkan bisa unggah ktp selalu error scan muncul bagaimana investasi pasar uang langsung hilang aplikasi tolol lebih baik pakai seeds indogold,-9,Negatif
kecewa soalnya mau update buku tabungan aplikasinya bisa permohonan tidak disetujui,kecewa soal mau update buku tabung aplikasi bisa mohon tidak tuju,-7,Negatif
sudah menabung selama bulan transaksi aman nyaman semoga berjalan baik lancar terima kasih bareksa,sudah tabung lama bulan transaksi aman nyaman moga jalan baik lancar terima kasih bareksa,25,Positif
memesan reksa dana saat transfer lupa mencantumkan nomor pesanan apa gan pesanan pembelian reksa dana gagal saya sudah upload bukti transfernya bagaimana kawan,mes reksa dana saat transfer lupa cantum nomor pesan apa gan pesan beli reksa dana gagal saya sudah upload bukti transfer bagaimana kawan,13,Positif
daftar akun keluar sendirinya memasukkan data pribadi tetapi akhirnya saya harus mendaftar dan ini menyakitkan,daftar akun keluar sendiri masuk data pribadi tetapi akhir saya harus daftar dan ini sakit,-23,Negatif
susahnya daftar kali stuck daftar rekening bank dapat memproses copot pemasangan otomatis,susah daftar kali stuck daftar rekening bank dapat proses copot pasang otomatis,6,Positif
proses pembelian reksa dana memakan waktu lebih lama dibandingkan kompetitor lainnya okelah voucher cashback,proses beli reksa dana makan waktu lebih lama banding kompetitor lain oke voucher cashback,11,Positif
aplikasinya bobrok hampir sebulan menjual reksa dana belum di rekening hai bareksa jangan dijadikan aplikasi investasi mending jadi aplikasi jaga amal masjid lebih tepat uang rakyat berkeliaran sesuka hati,aplikasi bobrok hampir bulan jual reksa dana belum di rekening hai bareksa jangan jadi aplikasi investasi mending jadi aplikasi jaga amal masjid lebih tepat uang rakyat liar suka hati,2,Positif
tampilannya user friendly sarannya manfaatkan sampoerna mendorong menabung reksa dana,tampil user friendly saran manfaat sampoerna dorong tabung reksa dana,18,Positif
bagus transaksi nunggunya lama aplikasi terus diupdate tidak diberitahu keuntungan apa mungkin dapat,bagus transaksi nunggunya lama aplikasi terus diupdate tidak diberitahu untung apa mungkin dapat,-9,Negatif
peningkatan lebih lanjut kinerja tanggung jawab hubungan baik selalu terjaga,tingkat lebih lanjut kerja tanggung jawab hubung baik selalu jaga,13,Positif
berinvestasi mudah mudah jelas meski untung penuh harus memberikan kepercayaan diri bisa memulainya meski kecil melalui reksa dana bareksa,investasi mudah mudah jelas meski untung penuh harus beri percaya diri bisa mula meski kecil lalu reksa dana bareksa,13,Positif
proses penjualan menjadi terhambat kode verifikasi dikirim melalui ponsel tersedia terkirim harus menunggu lama,proses jual jadi hambat kode verifikasi kirim lalu ponsel sedia kirim harus tunggu lama,-4,Negatif
customer service cukup responsif sangat membantu tingkatkan terus pelayanannya terima kasih bareksa,customer service cukup responsif sangat bantu tingkat terus layan terima kasih bareksa,22,Positif
semuanya baik saja ada informasi rasio pengeluaran sebenarnya penting yakin pimpinan tertinggi bareksa akan berpikir kali ingin membeli rumah diceritakan semua plus minusnya rumah tersebut harga rumah sendiri diberitahukan pemimpin tertinggiapalagi rakyat biasaingin beli rumah tak diberitahu harganya rasio biaya,semua baik saja ada informasi rasio keluar benar penting yakin pimpin tinggi bareksa akan pikir kali ingin beli rumah cerita semua plus minus rumah sebut harga rumah sendiri diberitahukan pimpin tertinggiapalagi rakyat biasaingin beli rumah tak diberitahu harga rasio biaya,27,Positif
aplikasi investasi mudah aman terpercaya pemula pilihan reksa dananya banyak pegadaian treasury emas robo advisors kinerjanya bagus,aplikasi investasi mudah aman percaya mula pilih reksa dana banyak gadai treasury emas robo advisors kerja bagus,13,Positif
sangat mudah digunakan cocok kaum milenial investasinya mudah,sangat mudah guna cocok kaum milenial investasi mudah,16,Positif
bareksa update harga membutuhkan waktu lama untuk jual beli uang masuk rekening membutuhkan waktu lama,bareksa update harga butuh waktu lama untuk jual beli uang masuk rekening butuh waktu lama,-17,Negatif
sangat mudah digunakan cocok kaum milenial investasinya mudah,sangat mudah guna cocok kaum milenial investasi mudah,16,Positif
bareksa update harga membutuhkan waktu lama untuk jual beli uang masuk rekening membutuhkan waktu lama,bareksa update harga butuh waktu lama untuk jual beli uang masuk rekening butuh waktu lama,-17,Negatif
sebelumnya mulai berinvestasi melalui ovo aplikasi ada redirect aplikasi bareksa mau login daftar tidak login menggunakan nomor telepon mohon pencerahannya uang yang investasikan hasil puasa saya tapi tidak berhasil bagaimana cara mengaksesnya,belum mulai investasi lalu ovo aplikasi ada redirect aplikasi bareksa mau login daftar tidak login guna nomor telepon mohon cerah uang yang investasi hasil puasa saya tapi tidak hasil bagaimana cara akses,-6,Negatif
sedikit masukan infestasi emas membeli hitungan detik untuk menjualnya memakan waktu beberapa hari mungkin yang perlu dilakukan cepat penjualan aplikasi sebelah jual beli cepat masuk rekening kita perlu keadaan darurat dicairkan secepatnya terima kasih tidak keuntungan infestasi emas besar kecil kalau mas antam naik bareksa kurang paham nilainya berapa perhitungan per gramnya,sedikit masuk infestasi emas beli hitung detik untuk jual makan waktu beberapa hari mungkin yang perlu laku cepat jual aplikasi belah jual beli cepat masuk rekening kita perlu ada darurat cair cepat terima kasih tidak untung infestasi emas besar kecil kalau mas antam naik bareksa kurang paham nilai berapa hitung per gram,5,Positif
oke saya ubah ratingnya padahal sempat masalah bagian verifikasi akun pelayanan live customer service sangat cepat cukup memuaskan minusnya pada verifikasi bug terkait pendaftaran akun pertama kali perlu diperbaiki,oke saya ubah ratingnya padahal sempat masalah bagi verifikasi akun layan live customer service sangat cepat cukup muas minus pada verifikasi bug kait daftar akun pertama kali perlu baik,11,Positif
data diri banyak salah agama hindu nomor telepon tidak bisa diubah nomor hilang sudah mengirim email tidak tanggapan ingin berinvestasi takutnya suatu nanti ada masalah data diri belum sesuai,data diri banyak salah agama hindu nomor telepon tidak bisa ubah nomor hilang sudah kirim email tidak tanggap ingin investasi takut suatu nanti ada masalah data diri belum sesuai,-12,Negatif
ingin mengubah data pribadi di aplikasi bareksa mengkonfirmasi perubahan data pribadi setelah hari buktinya perubahan bantu aplikasinya bekerja lebih baik saat saya belum puas kinerja bareksa terima kasih,ingin ubah data pribadi di aplikasi bareksa konfirmasi ubah data pribadi telah hari bukti ubah bantu aplikasi kerja lebih baik saat saya belum puas kerja bareksa terima kasih,-5,Negatif
susah banget ganti data dua kali minta ganti data agama status perkawinan ada kemajuan bagaimana mengelola banyak uang mengurus kecil anda tidak akan menyelesaikannya,susah banget ganti data dua kali minta ganti data agama status kawin ada maju bagaimana kelola banyak uang urus kecil anda tidak akan selesai,-3,Negatif
daftar bisa nik terdaftar saya baru install aplikasinya tanya customer service lama sekali balasannya saya juga bisa kirim gambar ss kolom chat,daftar bisa nik daftar saya baru install aplikasi tanya customer service lama sekali balas saya juga bisa kirim gambar ss kolom chat,-4,Negatif
csnya sangat lambat menyelesaikan masalah pengguna tidak lemot tadinya tidak berniat ovo bagus giliran pindah sini semuanya semakin parah mulai pergantian email nomor handphone lemot banget tidak jelas verifikasi punya dana ovo invest jutaan di deposit belum di deposit bareksa mohon berbaik hati tidak transfer kembalikan ke bareksa bentuk saldo ovo,csnya sangat lambat selesai masalah guna tidak lot tadi tidak niat ovo bagus gilir pindah sini semua makin parah mulai ganti email nomor handphone lot banget tidak jelas verifikasi punya dana ovo invest juta di deposit belum di deposit bareksa mohon baik hati tidak transfer kembali ke bareksa bentuk saldo ovo,-12,Negatif
aplikasi tiba tiba minta pin tidak akses padahal biasanya langsung masuk jadi repot ada dana dimasukkan,aplikasi tiba tiba minta pin tidak akses padahal biasa langsung masuk jadi repot ada dana masuk,-12,Negatif
aplikasi investasi sulit jelek,aplikasi investasi sulit jelek,-9,Negatif
baru update aplikasinya malah bisa dibuka anda mengklik ikon aplikasi aplikasi tersebut langsung menutup otomatis,baru update aplikasi malah bisa buka anda klik ikon aplikasi aplikasi sebut langsung tutup otomatis,-11,Negatif
kok bareksa begini data diri salah sudah menunggu seminggu belum satu huruf tidak masuk bank,kok bareksa begini data diri salah sudah tunggu minggu belum satu huruf tidak masuk bank,-17,Negatif
pelayanannya lama pencairan dananya lama customer service chatnya responnya itu bagaimana anda mengucurkan dana jumlah besar cukup gunakan bareksa sekali,layan lama cair dana lama customer service chatnya responnya itu bagaimana anda kucur dana jumlah besar cukup guna bareksa sekali,8,Positif
penggunaan aplikasi bareksa sangat aman mudah dipahami akan selalu menambah saldo pemasukan lancar,guna aplikasi bareksa sangat aman mudah paham akan selalu tambah saldo pasu lancar,18,Positif
aplikasi lancar informasi jelas mudah banyak pilihan awal instalasi sekarang aplikasi lancar pembelian lancar penjualan lancar alhamdulillah yang cukup aneh kalau investasinya banyak sedikit hasilnya per hari sama ribu haha,aplikasi lancar informasi jelas mudah banyak pilih awal instalasi sekarang aplikasi lancar beli lancar jual lancar alhamdulillah yang cukup aneh kalau investasi banyak sedikit hasil per hari sama ribu haha,30,Positif
kecewa banget sama pelayanannya verifikasinya lama banget kalau kendala bertanya live chat responnya lama sekali mungkin perlu banyak perbaikan terkait respon masalah pengguna pengguna lebih nyaman ada respon cepat kendala dialaminya saja terima kasih,kecewa banget sama layan verifikasi lama banget kalau kendala tanya live chat responnya lama sekali mungkin perlu banyak baik kait respon masalah guna guna lebih nyaman ada respon cepat kendala alam saja terima kasih,6,Positif
diupdate tidak dibuka mohon segera diperbaiki terima kasih,diupdate tidak buka mohon segera baik terima kasih,10,Positif
diupdate aplikasi dapat digunakan oke bisa melakukannya,diupdate aplikasi dapat guna oke bisa laku,1,Positif
diupdate aplikasi malah bisa masuk mentalnya selalu keluar sendiri,diupdate aplikasi malah bisa masuk mental selalu keluar sendiri,-18,Negatif
lebih mudah anda bergabung ovo sekarang ganti nomor ponsel jadi repot kalau mau pencairan punya nomor rekening bisa ewallet,lebih mudah anda gabung ovo sekarang ganti nomor ponsel jadi repot kalau mau cair punya nomor rekening bisa ewallet,3,Positif
inilah penyebab tiba tiba aplikasi bisa dibuka segera selesaikan masalah terima kasih,ini sebab tiba tiba aplikasi bisa buka segera selesai masalah terima kasih,1,Positif
laporkan kominfoojk menyulitkan investor menarik uangnya penanganannya lama sekali emailnya lama pindah ovo bareksa data bareksa sinkron daftarkan ovo juga mendaftarkan nomor rec ovo invest saya daftar ulang pindah bareksa padahal nomornya salah otpnya ke nomor yang salah sangat buruk ada bintang di bawah lebih buruk,lapor kominfoojk sulit investor tarik uang tangan lama sekali email lama pindah ovo bareksa data bareksa sinkron daftar ovo juga daftar nomor rec ovo invest saya daftar ulang pindah bareksa padahal nomor salah otpnya ke nomor yang salah sangat buruk ada bintang di bawah lebih buruk,-30,Negatif
kecewa banget bareksa aplikasi lama melakukan transaksi penjualan reksa dana penerimaan uangnya jauh melebihi hari ditentukan bareksa hari bagaimana kalau begini saya butuh dana segera memakan waktu terlalu lama dibandingkan aplikasi investasi lainnya pakbu katanya kalau masalah silahkan live chat tidak respon begitulah gan mohon diperbaiki fast responnya terima kasih,kecewa banget bareksa aplikasi lama laku transaksi jual reksa dana terima uang jauh lebih hari tentu bareksa hari bagaimana kalau begini saya butuh dana segera makan waktu terlalu lama banding aplikasi investasi lain pakbu kata kalau masalah silah live chat tidak respon begitu gan mohon baik fast responnya terima kasih,-27,Negatif
jujur cukup kecewa awalnya ovo lalu pindah sini penjualan reksa dana aplikasi langsung melibatkan semacam pajak jumlahnya cukup besar sebelumnya ovo penjualan reksa dana dikenakan biaya juga memungkinkan proses pencairannya ditambahkan ewallet apa seperti ovo dana gopay lain sebagainya,jujur cukup kecewa awal ovo lalu pindah sini jual reksa dana aplikasi langsung libat macam pajak jumlah cukup besar belum ovo jual reksa dana kena biaya juga mungkin proses cair tambah ewallet apa seperti ovo dana gopay lain bagai,16,Positif
aplikasinya bagus lama menggunakan aplikasi lalu mematikannya ketika mengaktifkannya sulit mengganti nomor ponsel padahal nomor handphone daftarkan sebelumnya aktif tidak gunakan saya sudah mencoba mengirim email customer service meminta perubahan nomor ponsel masih tidak mudah mengganti nomor telepon terdaftar sini dengan berat hati akhirnya saya tidak meneruskannya,aplikasi bagus lama guna aplikasi lalu mati ketika aktif sulit ganti nomor ponsel padahal nomor handphone daftar belum aktif tidak guna saya sudah coba kirim email customer service minta ubah nomor ponsel masih tidak mudah ganti nomor telepon daftar sini dengan berat hati akhir saya tidak terus,-8,Negatif
ganti nomor handphone susah ribetresponnya kurang baik aplikasi ganti nomor handphone mudah ribet jawabannya antrisilahkan dicek lagiemailnya terkirimjadi jadi user,ganti nomor handphone susah ribetresponnya kurang baik aplikasi ganti nomor handphone mudah ribet jawab antrisilahkan cek lagiemailnya terkirimjadi jadi user,-3,Negatif
beberapa kali mengambil foto ktp namun gagal pernyataan tersebut bukan merupakan foto ektp padahal fotonya sangat jelas beda customer service beda jauh pelayanannya semakin sering ganti customer service semakin lambat pelayanannya katanya suruh uninstall aplikasinya dulu tetap bisa diupload mboh lah malas sakk krpmu arp ganti aplikasi aeee garai badmood ae semua ki,beberapa kali ambil foto ktp namun gagal nyata sebut bukan rupa foto ektp padahal foto sangat jelas beda customer service beda jauh layan makin sering ganti customer service makin lambat layan kata suruh uninstall aplikasi dulu tetap bisa diupload mboh lah malas sakk krpmu arp ganti aplikasi aeee garai badmood ae semua ki,-18,Negatif
pelayanan buruk lama respon beli rdpt juta berhasil uang kembali selama hari karena dibeli rekening csnya jelek banget keluhan melalui chat email diabaikan saja tidak ada tindak lanjut,layan buruk lama respon beli rdpt juta hasil uang kembali lama hari karena beli rekening csnya jelek banget keluh lalu chat email abai saja tidak ada tindak lanjut,-15,Negatif
ribet banget aplikasi ovo invest pindah bareksa coba apa harus masuk nomor rekeningnya enaknya pakai ovo cara cairnya simple mudah ribet,ribet banget aplikasi ovo invest pindah bareksa coba apa harus masuk nomor rekening enak pakai ovo cara cair simple mudah ribet,-14,Negatif
aplikasinya sedang disempurnakan sekarang beli saham keren banget,aplikasi sedang sempurna sekarang beli saham keren banget,2,Positif
inilah sebabnya aplikasi tb bisa dibuka dibuka langsung close sendiri,ini sebab aplikasi tb bisa buka buka langsung close sendiri,3,Positif
tidak menyangka bareksa memverifikasi dengan cepat hari itu luar biasa,tidak sangka bareksa verifikasi dengan cepat hari itu luar biasa,-2,Negatif
investasi layak bareksa bisa dibuka diupdate bagaimana caranya bagaimana uang yang berkisar juta,investasi layak bareksa bisa buka diupdate bagaimana cara bagaimana uang yang kisar juta,3,Positif
proses penjualannya memakan waktu sangat lama hari kerja notifikasi dana sampai pas cek dananya sampai customer service sangat lambat merespon,proses jual makan waktu sangat lama hari kerja notifikasi dana sampai pas cek dana sampai customer service sangat lambat merespon,18,Positif
aplikasinya jelek sudah masukkan nomornya dan juga tidak mengubah data pribadi kalau bisa untuk memudahkan penarikan bisa menggunakan ewallet ovo dana gopay,aplikasi jelek sudah masuk nomor dan juga tidak ubah data pribadi kalau bisa untuk mudah tari bisa guna ewallet ovo dana gopay,-9,Negatif
alhamdulillah daftarnya mudah ribet fitur lengkap keren sangat direkomendasikan pemula investasi,alhamdulillah daftar mudah ribet fitur lengkap keren sangat rekomendasi mula investasi,6,Positif
kecewa aplikasi berinvestasi ovo invest katanya pindah bareksa buka bareksa saldo hilang saya sangat kecewa uang saya hilang entah,kecewa aplikasi investasi ovo invest kata pindah bareksa buka bareksa saldo hilang saya sangat kecewa uang saya hilang entah,-19,Negatif
kok penambahannya sama dulu sudah komplain cek jawabannya lumayan selisihnya k per hari mulai main main sama investorcustomer investor periksa hitung ulang penambahan per hari hatihati memotongnya diamdiam,kok tambah sama dulu sudah komplain cek jawab lumayan selisih k per hari mulai main main sama investorcustomer investor periksa hitung ulang tambah per hari hatihati potong diamdiam,-7,Negatif
menambah rekening bca susah sekali padahal nomor rekening nama bareksa sama jangan mempersulit aplikatornya aplikasi sebelah menambahkan akun cimb sangatlah mudah,tambah rekening bca susah sekali padahal nomor rekening nama bareksa sama jangan sulit aplikatornya aplikasi belah tambah akun cimb sangat mudah,-5,Negatif
saham terbatas juga metode pembayaran sangat terbatas bank bisa digunakan bank danamon direct debit kalau punya susah kalau pakai ewallet biayanya mahal,saham batas juga metode bayar sangat batas bank bisa guna bank danamon direct debit kalau punya susah kalau pakai ewallet biaya mahal,-10,Negatif
pengembang terhormat lebih menarik bareksa menambahkan widget pembaruan terkini layar beranda saya sangat mengapresiasi kinerja dengan memberikan rating bintang,kembang hormat lebih tarik bareksa tambah widget baru kini layar beranda saya sangat apresiasi kerja dengan beri rating bintang,17,Positif
respon customer service bareksa menyelesaikan permasalahan pengguna melalui email sangat mengecewakan pembuatan akun terhambat verifikasi disebutkan nama aplikasi nama pemilik rekening bank berbeda padahal data dimasukkan benar sama semoga kedepannya ada masalah aplikasi diselesaikan aplikasi harus menghubungi customer service customer service sangat mengecewakan,respon customer service bareksa selesai masalah guna lalu email sangat kecewa buat akun hambat verifikasi sebut nama aplikasi nama milik rekening bank beda padahal data masuk benar sama moga depan ada masalah aplikasi selesai aplikasi harus hubung customer service customer service sangat kecewa,-32,Negatif
bareksa bisa diakses min ada masalah sistem,bareksa bisa akses min ada masalah sistem,-2,Negatif
keseluruhan aplikasi berjalan lancar saja biaya pembelian rd ditekan terlalu mahal saya isi ulang pakai bca biayanya lumayan besar isi ulang semoga kedepannya solusinya terima kasih,seluruh aplikasi jalan lancar saja biaya beli rd tekan terlalu mahal saya isi ulang pakai bca biaya lumayan besar isi ulang moga depan solusi terima kasih,1,Positif
penanganan customer service layak mendapatkan satu bintang disuruh menunggu diberi kejelasan diberi update perkembangan tunggu hari saya menunggu selama hari masih ada kemajuan penanganannya sangat lambat ini cara customer service menangani masalah,tangan customer service layak dapat satu bintang suruh tunggu beri jelas beri update kembang tunggu hari saya tunggu lama hari masih ada maju tangan sangat lambat ini cara customer service tangan masalah,4,Positif
aplikasi reksa dana mudah digunakan dibeli penerapannya sulit aplikasi super memiliki cara meningkatkan kecepatan perbaiki,aplikasi reksa dana mudah guna beli terap sulit aplikasi super milik cara tingkat cepat baik,17,Positif
customer service bareksa responnya lambat sekali sama sekali pengajuan transfer rekening diubah akun email baru padahal beberapa kali kirim email tetap tidak ada respon sama sekali melalui email apa format benar selalu lewat ngobrol lihat tidak membuat segalanya lebih mudah bagimu email customer service sangat lambat merespons,customer service bareksa responnya lambat sekali sama sekali aju transfer rekening ubah akun email baru padahal beberapa kali kirim email tetap tidak ada respon sama sekali lalu email apa format benar selalu lewat ngobrol lihat tidak buat segala lebih mudah bagi email customer service sangat lambat respons,13,Positif
kelebihannya fiturnya banyak kelemahannya pemrosesan keluhan permintaan memakan waktu berhari hari satu set tidak cukup,lebih fiturnya banyak lemah pemrosesan keluh minta makan waktu hari hari satu set tidak cukup,8,Positif
kemarin baru mencoba modal minimal ribu membeli emas ternyata harus deposit ribu menarik minimal ribu sayangnya entah harga emas terus turun uang bisa kurang lebih bulan dicairkan sekarang hangus tidak fitur penarikan kembalikan uang nanti ubah penilaiannya,kemarin baru coba modal minimal ribu beli emas nyata harus deposit ribu tarik minimal ribu sayang entah harga emas terus turun uang bisa kurang lebih bulan cair sekarang hangus tidak fitur tari kembali uang nanti ubah nilai,-2,Negatif
