text asli,text_prepro,compound scores,Sentimen
ingin bertanya bagaimana sistem keamanan pengguna aplikasi khawatir terjadi pembobolan akun kemudian dana disimpan dibobol satu apakah bukti kekuatan hukum nasabah nasabah benar benar memiliki investasi share terima kasih,ingin tanya bagaimana sistem aman guna aplikasi khawatir jadi bobol akun kemudian dana simpan bobol satu apakah bukti kuat hukum nasabah nasabah benar benar milik investasi share terima kasih,15,Positif
apabila foto id kamera selalu error sudah diperbaiki akan menambah bintangnya,apabila foto id kamera selalu error sudah baik akan tambah bintang,7,Positif
proses pembelian memakan waktu cukup lama jumat lalu coba beli kenapa tertulis unit proses pembelian,proses beli makan waktu cukup lama jumat lalu coba beli kenapa tulis unit proses beli,6,Positif
seringkali sulit dibuka padahal jaringan koneksinya bagus,seringkali sulit buka padahal jaring koneksi bagus,6,Positif
kok jualan reksadana selalu tertulis ditulis penukaran pesanan valid dicek unitnya,kok jual reksadana selalu tulis tulis tukar pesan valid cek unit,-4,Negatif
bruh loginaplikasinya keluar sendirinya coba gunakan karena aplikasi masih memiliki produk cukup aplikasi berikutnya berfungsi baik,bruh loginaplikasinya keluar sendiri coba guna karena aplikasi masih milik produk cukup aplikasi ikut fungsi baik,-11,Negatif
ingin mendaftar bareksa tidak memasukkan nomor rekening bank mohon bantuannya,ingin daftar bareksa tidak masuk nomor rekening bank mohon bantu,-2,Negatif
bisa langsung menghapus semua notifikasi dilakukan satu per satu merepotkan,bisa langsung hapus semua notifikasi laku satu per satu repot,-2,Negatif
bintang kurang puas aplikasinya jelek malas lanjut,bintang kurang puas aplikasi jelek malas lanjut,-11,Negatif
min aplikasi baru sering keluar sendiri perbaiki,min aplikasi baru sering keluar sendiri baik,-4,Negatif
sebenarnya bagus sayang sekali pencariannya lama padahal katanya bisa tarik dana kapan kita mau,benar bagus sayang sekali cari lama padahal kata bisa tarik dana kapan kita mau,0,Positif
sangat sulit mendaftar sudah mendaftar selama minggu belum selesai,sangat sulit daftar sudah daftar lama minggu belum selesai,2,Positif
upload bukti transaksi tertunda terus gagal pesanan memakan waktu terlalu lama masuk dalam portofolio,upload bukti transaksi tunda terus gagal pesan makan waktu terlalu lama masuk dalam portofolio,-6,Negatif
melakukan penarikan tanggal september kemarin katanya sukses tanggal september kok hari masuk akun gan,laku tari tanggal september kemarin kata sukses tanggal september kok hari masuk akun gan,-11,Negatif
lebih baik terdapat riwayat transaksi pembayaran belum dibayar lunas aplikasi dibandingkan melalui email,lebih baik dapat riwayat transaksi bayar belum bayar lunas aplikasi banding lalu email,11,Positif
mohon maaf kebetulan ektp buram bisa terbaca kamera handphone jadi mungkin nilainya berbeda,mohon maaf betul ektp buram bisa baca kamera handphone jadi mungkin nilai beda,8,Positif
mohon diperbaiki lebih lanjut edit profil update,mohon baik lebih lanjut edit profil update,8,Positif
semoga ditambah fitur pengelompokan investasi berdasarkan kebutuhan misal investasi dana pensiun sekolah anak jadi kayak beda kantong investasi walaupun reksa dana yang maka kalau biaya topupnya bakalan mahal bi cepat cuma bank lain pun gratis untuk sekali top up,moga tambah fitur kelompok investasi dasar butuh misal investasi dana pensiun sekolah anak jadi kayak beda kantong investasi walaupun reksa dana yang maka kalau biaya topupnya bakal mahal bi cepat cuma bank lain pun gratis untuk sekali top up,-6,Negatif
diupdate tidak dibuka mohon segera diperbaiki terima kasih,diupdate tidak buka mohon segera baik terima kasih,10,Positif
inilah sebabnya aplikasi tb bisa dibuka dibuka langsung close sendiri,ini sebab aplikasi tb bisa buka buka langsung close sendiri,3,Positif
saham terbatas juga metode pembayaran sangat terbatas bank bisa digunakan bank danamon direct debit kalau punya susah kalau pakai ewallet biayanya mahal,saham batas juga metode bayar sangat batas bank bisa guna bank danamon direct debit kalau punya susah kalau pakai ewallet biaya mahal,-10,Negatif
aplikasi reksa dana mudah digunakan dibeli penerapannya sulit aplikasi super memiliki cara meningkatkan kecepatan perbaiki,aplikasi reksa dana mudah guna beli terap sulit aplikasi super milik cara tingkat cepat baik,17,Positif
kelebihannya fiturnya banyak kelemahannya pemrosesan keluhan permintaan memakan waktu berhari hari satu set tidak cukup,lebih fiturnya banyak lemah pemrosesan keluh minta makan waktu hari hari satu set tidak cukup,8,Positif
produk reksa dana cukup bervariasi fitur penting perlu di bareksa histori untung rugi setiap transaksi penjualan reksa dana sejauh mengetahui untung rugi realisasi investasi kami riwayat chat customer service lewat aplikasi obrolan baru muncul obrolan lama dihapus dengan akun sama dibackup melalui email aplikasi mudah ditindak lanjuti semoga segera diterbitkan ayo tim teknis bisa,produk reksa dana cukup variasi fitur penting perlu di bareksa histori untung rugi tiap transaksi jual reksa dana jauh tahu untung rugi realisasi investasi kami riwayat chat customer service lewat aplikasi obrol baru muncul obrol lama hapus dengan akun sama dibackup lalu email aplikasi mudah tindak lanjut moga segera terbit ayo tim teknis bisa,28,Positif
kok aplikasinya selalu force closes bisa masuk tanggal juni,kok aplikasi selalu force closes bisa masuk tanggal juni,-11,Negatif
bareksa kalau mau investasi pakai virtual bank kalau iya virtual bank sering error menggunakan virtual account jadi tambahkan nomor rekening bank asli terima kasih,bareksa kalau mau investasi pakai virtual bank kalau iya virtual bank sering error guna virtual account jadi tambah nomor rekening bank asli terima kasih,10,Positif
pilihan data pribadi perlu disesuaikan setiap kali scroll bawah selalu menekan item perlu akhirnya agama status perkawinan sumber pendapatan tujuan investasi cenderung berubah tidak sengaja pas mau ganti tidak bisa server error,pilih data pribadi perlu sesuai tiap kali scroll bawah selalu tekan item perlu akhir agama status kawin sumber dapat tuju investasi cenderung ubah tidak sengaja pas mau ganti tidak bisa server error,-10,Negatif
wah install aplikasi dan baca komentar pelanggan otomatis uninstall aplikasinya sangat meyakinkan,wah install aplikasi dan baca komentar langgan otomatis uninstall aplikasi sangat yakin,4,Positif
min silahkan melakukan pencairan melalui ewallet memudahkan pengguna dalam melakukan transaksi aplikasi,min silah laku cair lalu ewallet mudah guna dalam laku transaksi aplikasi,13,Positif
catatan masalah peralihan pengelompokan tujuan investasi percepat proses perpindahan memungkinkan segera minimal menit buat fitur mengelompokkan tujuan investasi beserta total target notifikasi barometer dalamnya terima kasih,catat masalah alih kelompok tuju investasi cepat proses pindah mungkin segera minimal menit buat fitur kelompok tuju investasi serta total target notifikasi barometer dalam terima kasih,4,Positif
jual beli waktunya terlalu lama mohon update prospeknya hari,jual beli waktu terlalu lama mohon update prospek hari,-3,Negatif
tujuan dengan bareksa fitur tabungan emas setelah mendaftar fitur emas tiba tiba hilang menumenunya tidak apakah memang hilang permanen akun saja tidak bareksa tidak belum mempunyai fitur chat langsung customer service aplikasi tetangga ada hanya email customer service telepon kantor faq semoga kedepannya ditambah fitur chat langsung customer service sangat memudahkan pemula masih bingung terima kasih,tuju dengan bareksa fitur tabung emas telah daftar fitur emas tiba tiba hilang menumenunya tidak apakah memang hilang permanen akun saja tidak bareksa tidak belum punya fitur chat langsung customer service aplikasi tetangga ada hanya email customer service telepon kantor faq moga depan tambah fitur chat langsung customer service sangat mudah mula masih bingung terima kasih,4,Positif
kalau update play store aplikasinya bisa dibuka errornya kerlip di update berjalan lancar artinya tidak langsung memaksa untuk segera mengupdate aplikasinya jempol trik bareksa,kalau update play store aplikasi bisa buka errornya kerlip di update jalan lancar arti tidak langsung paksa untuk segera mengupdate aplikasi jempol trik bareksa,-1,Negatif
x pembayaran lewat virtual account bca langsung terupdate aplikasi bareksa menunggu pembayaran padahal rekening terdebet pembayaran virtual account harap segera diperbaiki ingin cepat menambah biaya pembelian malah memakan waktu lama untuk biaya pembayaran lewat virtual account bca kalau begini layanannya gratis semoga kedepannya lebih baik,x bayar lewat virtual account bca langsung terupdate aplikasi bareksa tunggu bayar padahal rekening debet bayar virtual account harap segera baik ingin cepat tambah biaya beli malah makan waktu lama untuk biaya bayar lewat virtual account bca kalau begini layan gratis moga depan lebih baik,16,Positif
memungkinkan tambahkan metode pembayaran selain ovo transfer manual bagi pribadi hanya mencari uang receh biaya transfer antar bank cukup memberatkan overall pelayanannya cukup responsif,mungkin tambah metode bayar selain ovo transfer manual bagi pribadi hanya cari uang receh biaya transfer antar bank cukup berat overall layan cukup responsif,4,Positif
bintang dulu min soalnya saya proses tambah akun baru ganti akun lumayan lama beberapa bulan baru verifikasi kurang cepat juga ada customer service online bisa ngobrol langsung lewat wa berbeda kompetitor sebelah silakan pertimbangkan layanan pelanggan online,bintang dulu min soal saya proses tambah akun baru ganti akun lumayan lama beberapa bulan baru verifikasi kurang cepat juga ada customer service online bisa ngobrol langsung lewat wa beda kompetitor belah sila timbang layan langgan online,3,Positif
update v sidik jari dapat digunakan pin login benar terdeteksi salah samsung as one ui v android v,update v sidik jari dapat guna pin login benar deteksi salah samsung as one ui v android v,-3,Negatif
hari pukul terjadi perubahan nilai satuannyakenapa hari tidak,hari pukul jadi ubah nilai satuannyakenapa hari tidak,-4,Negatif
selamat siang bareksa juga pernah menggunakan aplikasi tersebut dua bulan tiba tiba aplikasi tersebut bisa diakses mungkin perlu update setelah di update tetap bisa diakses mohon penanganannya,selamat siang bareksa juga pernah guna aplikasi sebut dua bulan tiba tiba aplikasi sebut bisa akses mungkin perlu update telah di update tetap bisa akses mohon tangan,3,Positif
kalau masuk tahunnya benar dikatakan terdaftar dukcapil cek lalu edit dan koreksi tetap dikatakan terdaftar bingung enaknya ajaib bibitnya isi datanya mudah bisakah membantu memeriksanya tidak,kalau masuk tahun benar kata daftar dukcapil cek lalu edit dan koreksi tetap kata daftar bingung enak ajaib bibit isi data mudah bisa bantu periksa tidak,-7,Negatif
tingkatkan pembayaran melalui dompet digital ewallet dompet digital waktu disediakan sangat minim detik terkadang gagal membayar saya diberi waktu sebanyak bagaimana ingin bersaing orang di lingkungan sebaliknya ada waktu membayar,tingkat bayar lalu dompet digital ewallet dompet digital waktu sedia sangat minim detik terkadang gagal bayar saya beri waktu banyak bagaimana ingin saing orang di lingkung balik ada waktu bayar,10,Positif
investasi emas tidak padahal semua orang mau ganti bareksa tidak punya padahal orang termasuk tipe tidak mau banyak aplikasi jadi kalau misalnya aplikasi bagus mencakup banyak jenis worth it banget sayang saya tidak bisa berinvestasi bareksa lagi,investasi emas tidak padahal semua orang mau ganti bareksa tidak punya padahal orang masuk tipe tidak mau banyak aplikasi jadi kalau misal aplikasi bagus cakup banyak jenis worth it banget sayang saya tidak bisa investasi bareksa lagi,-21,Negatif
tahun lalu laporan memberi bukti mendukung tahun masuk menu email japri malah disuruh lihat website aksei aksei situs website tidak ada informasi keuntungan direalisasikan,tahun lalu lapor beri bukti dukung tahun masuk menu email japri malah suruh lihat website aksei aksei situs website tidak ada informasi untung realisasi,1,Positif
buka bareksa selalu muncul koneksi terputus gagal load portofolio coba pakai data wifi handphone tapi tetap bisa saya buka saya upgrade masih itu,buka bareksa selalu muncul koneksi putus gagal load portofolio coba pakai data wifi handphone tapi tetap bisa saya buka saya upgrade masih itu,-1,Negatif
seringkali pesan koneksi terputus padahal buka tokopedia lain tidak masalah jadi mau cek saldo cukup susah sering dikatakan koneksi terputus mungkin pelayanannya ditingkatkan terima kasih,seringkali pesan koneksi putus padahal buka tokopedia lain tidak masalah jadi mau cek saldo cukup susah sering kata koneksi putus mungkin layan tingkat terima kasih,10,Positif
biaya admin mahaluntuk top up rd pakai ovo sudah kerja sama kami jual rd dipotong kali pertama pilih rekening beda bank kedua uang sesuai nominal dikurangi lalu untuk voucher cashback rd lama banget masuknya baru masuk bulan tanggal pembelian kurang bersaing aplikasi,biaya admin mahaluntuk top up rd pakai ovo sudah kerja sama kami jual rd potong kali pertama pilih rekening beda bank dua uang sesuai nominal rang lalu untuk voucher cashback rd lama banget masuk baru masuk bulan tanggal beli kurang saing aplikasi,-7,Negatif
pertama kali mencobanya aplikasinya terus berkedip sulit dibuka padahal baru mulai berinvestasi sini update susah dibuka kedip terus tampaknya sejak fitur robot diperkenalkan itu menjadi sesulit,pertama kali coba aplikasi terus kedip sulit buka padahal baru mulai investasi sini update susah buka kedip terus tampak sejak fitur robot kenal itu jadi sulit,-3,Negatif
sistem aplikasi bareksa kurang bagus seed bayar reksa dana langsung nambah saldo padahal reksa dana aktif untuk respon admin aplikasi bareksa kurang memuaskan langsung chat otomatis aplikasi untuk komunikasi admin susah kadang penuh antri tidak bisa dibalas mohon diperbaiki sistem aplikasinya terima kasih,sistem aplikasi bareksa kurang bagus seed bayar reksa dana langsung nambah saldo padahal reksa dana aktif untuk respon admin aplikasi bareksa kurang muas langsung chat otomatis aplikasi untuk komunikasi admin susah kadang penuh antri tidak bisa balas mohon baik sistem aplikasi terima kasih,14,Positif
verifikasi akun rumit padahal screenshot informasi pembukaan rekening melalui tabungan digital dikirimkan y namanya tabungan digital ada bukti fisiknya ini buku tabungan fisik digunakan untuk pembukuan cari informasi mobile banking disana terdapat informasi nomor rekening saldo informasi lengkap tidak tersedia,verifikasi akun rumit padahal screenshot informasi buka rekening lalu tabung digital kirim y nama tabung digital ada bukti fisik ini buku tabung fisik guna untuk buku cari informasi mobile banking sana dapat informasi nomor rekening saldo informasi lengkap tidak sedia,18,Positif
awalnya sangat suka berinvestasi sini untuk pencairan dana rekening menunggu lama lebih hari padahal status transaksi selesai berbeda kompetitornya bibit sehari transaksi selesai dana masuk rekening,awal sangat suka investasi sini untuk cair dana rekening tunggu lama lebih hari padahal status transaksi selesai beda kompetitor bibit hari transaksi selesai dana masuk rekening,6,Positif
mengalami kesulitan melakukan pendaftaran akun sudah mendaftar sesuai persyaratan saat login akun bareksa tidak login email password salah padahal sudah memastikan emailnya kata sandi ditulis benar mohon penjelasannya,alami sulit laku daftar akun sudah daftar sesuai syarat saat login akun bareksa tidak login email password salah padahal sudah pasti email kata sandi tulis benar mohon jelas,2,Positif
bintang dulu kan versi mobile grafis produk reksa dananya belum ada pembayaran virtual account malah sekarang tidak link rekening reksadana bukalapak tokopedia,bintang dulu kan versi mobile grafis produk reksa dana belum ada bayar virtual account malah sekarang tidak link rekening reksadana bukalapak tokopedia,1,Positif
mohon mempercepat proses update harga satuan harian ibarat peramal membeli kucing karung diberi informasi harga satuan kemarin padahal hari anda membelinya mengikuti harga hari namun harganya diperbarui pembaruannya memakan waktu sangat lama proses pembelian unitnya lama,mohon cepat proses update harga satu hari ibarat amal beli kucing karung beri informasi harga satu kemarin padahal hari anda bel ikut harga hari namun harga baru baru makan waktu sangat lama proses beli unit lama,10,Positif
wajar hal dipersulit metode pembayaran masih terbatas sebaiknya menyediakan pembayaran melalui beberapa bank tidak dikenakan biaya admin jangan mengandalkan bank,wajar hal sulit metode bayar masih batas baik sedia bayar lalu beberapa bank tidak kena biaya admin jangan andal bank,-7,Negatif
kurang paham apa salahnya mendaftar bareksa sudah menunggu berbulanbulan akun aktif sekarang sering menerima email bareksa kira akun sudah diaktivasi ternyata belum mohon tindak lanjuti masalah karena ini membuat saya hampir kehilangan minat berinvestasi bareksa terima kasih,kurang paham apa salah daftar bareksa sudah tunggu berbulanbulan akun aktif sekarang sering terima email bareksa kira akun sudah diaktivasi nyata belum mohon tindak lanjut masalah karena ini buat saya hampir hilang minat investasi bareksa terima kasih,6,Positif
masukan kalau pembayaran pakai ovo lebih mudah jangan dipersulit transaksi pakai ovo selalu gagal tidak pakai pembayaran ovo memungkinkan sambungkan aplikasi ovo bareksa jadi langsung klik pembayaran menggunakan aplikasi bareksa terima kasih,masuk kalau bayar pakai ovo lebih mudah jangan sulit transaksi pakai ovo selalu gagal tidak pakai bayar ovo mungkin sambung aplikasi ovo bareksa jadi langsung klik bayar guna aplikasi bareksa terima kasih,-8,Negatif
bintang mohon disediakan berbagai metode pembayaran dapat bebas biaya transfer hemat ribu per bulan trf bank berbeda mengalami kerugian tunai sebesar awalnya terima kasih,bintang mohon sedia bagai metode bayar dapat bebas biaya transfer hemat ribu per bulan trf bank beda alami rugi tunai besar awal terima kasih,4,Positif
cukup kecewa aplikasi setiap pembelian selalu terlambat satu hari hari sejak beli april ada konfirmasi dm lewat instagram bareksa siang balasannya diproses berapa lama ingin memprosesnya,cukup kecewa aplikasi tiap beli selalu lambat satu hari hari sejak beli april ada konfirmasi dm lewat instagram bareksa siang balas proses berapa lama ingin proses,-1,Negatif
sayangnya hanya mempunyai rekening untuk mengganti rekening bank susah melalui email berbeda aplikasi sejenis lainnya bisa memiliki hingga rekening caranya mudah cukup lewat aplikasi,sayang hanya punya rekening untuk ganti rekening bank susah lalu email beda aplikasi jenis lain bisa milik hingga rekening cara mudah cukup lewat aplikasi,1,Positif
baru install cepat daftar akun sebelumnya sudah terdaftar bukalapak masih bisa membeli reksa dana masih proses verifikasi iklannya banyak sekali maaf cukup mengganggu buat,baru install cepat daftar akun belum sudah daftar bukalapak masih bisa beli reksa dana masih proses verifikasi iklan banyak sekali maaf cukup ganggu buat,10,Positif
sangat membantu mengenal saham transaksi mudah kurang saya transaksi melalui bank bca kalau tambah pilihan banknya terima kasih,sangat bantu kenal saham transaksi mudah kurang saya transaksi lalu bank bca kalau tambah pilih bank terima kasih,22,Positif
mohon maaf kasih bintang dulu mengalami kendala registrasi upload ektp saya tidak tekan tombol lanjutkan stuck terus disana mohon bantuannya segera memperbaiki bug tersebut terima kasih,mohon maaf kasih bintang dulu alami kendala registrasi upload ektp saya tidak tekan tombol lanjut stuck terus sana mohon bantu segera baik bug sebut terima kasih,7,Positif
pengurusan ganti nomor handphone ribet sekali sudah diminta konfirmasi lewat email tidak respon lambat sekali saat pergantian nomor aplikasi belum selesai,urus ganti nomor handphone ribet sekali sudah minta konfirmasi lewat email tidak respon lambat sekali saat ganti nomor aplikasi belum selesai,1,Positif
sekadar saran positif komandan profil risiko profil otomatis semua orang hanya orang pertama banyak metode pembayaran bisa berupa virtual banking ewallet,sekadar saran positif komandan profil risiko profil otomatis semua orang hanya orang pertama banyak metode bayar bisa upa virtual banking ewallet,-3,Negatif
sebenarnya keseluruhan rata rata bagus sayangnya masa tunggu pembelian unit penjualan unit penarikan rekening bank memakan waktu lama berhari hari bahkan isi ulang hari menarik dana rekening lama banget hari mohon waktu tunggunya diperbaiki perbedaan hari menentukan harga beli jual unit reksa dana,benar seluruh rata rata bagus sayang masa tunggu beli unit jual unit tari rekening bank makan waktu lama hari hari bahkan isi ulang hari tarik dana rekening lama banget hari mohon waktu tunggu baik beda hari tentu harga beli jual unit reksa dana,-10,Negatif
aplikasi ditutup klik kali selalu muncul diluncurkan sendiri android jadi sulit ditutup cocok,aplikasi tutup klik kali selalu muncul luncur sendiri android jadi sulit tutup cocok,-8,Negatif
kekurangannya bareksa sebaiknya memilih saham obligasi lebih berkelas selektif menampilkan produk kurang bagus tahunnya terkadang masyarakat mencari lebih baik pilihan investasi terbaik,kurang bareksa baik pilih saham obligasi lebih kelas selektif tampil produk kurang bagus tahun terkadang masyarakat cari lebih baik pilih investasi baik,3,Positif
beli reksa dana campuran harga lebih murahlalu proses haripadahal beli jam setengah beli harga lebih murah lalu naik harganya terus jam harganya turun otomatis rugikalo beli dikit masalahsaya beli jt otomatis rugitolong pak membeli jam kerja harap segera diprosesminimal jam hari baru selesai diproses,beli reksa dana campur harga lebih murahlalu proses haripadahal beli jam tengah beli harga lebih murah lalu naik harga terus jam harga turun otomatis rugikalo beli dikit masalahsaya beli jt otomatis rugitolong pak beli jam kerja harap segera diprosesminimal jam hari baru selesai proses,43,Positif
mau tarik dana gagal terus coba tambah nomor rekening beda bank tetap bisa sudah update aplikasi berhasil koneksi internet lancar ada solusinya,mau tarik dana gagal terus coba tambah nomor rekening beda bank tetap bisa sudah update aplikasi hasil koneksi internet lancar ada solusi,28,Positif
bagaimana cara cek investasi sbn menggunakan aplikasi silakan tambahkan nomor rekening bank silakan tambahkan sistem pembayaran aplikasi yang menggunakan gopay cukup tautkan syaratnya tidak dikenakan biaya transfer memungkinkan akan memberikan bintang,bagaimana cara cek investasi sbn guna aplikasi sila tambah nomor rekening bank sila tambah sistem bayar aplikasi yang guna gopay cukup taut syarat tidak kena biaya transfer mungkin akan beri bintang,-9,Negatif
sebenarnya bagus nyari produk reksadana sangat risih kalau scroll bawah malah selalu pindah tab reksa dana jenis,benar bagus nyari produk reksadana sangat risih kalau scroll bawah malah selalu pindah tab reksa dana jenis,9,Positif
dapat melihat grafik reksa dana portofolio sekarang jadi kalau mau lihat grafiknya cari dulu pencarian reksa dana bisa langsung portofolionya meskipun dulu itu mungkin terjadi saat ada perubahan fitur anda bisa melihat grafik perkembangan reksa dana portofolio anda,dapat lihat grafik reksa dana portofolio sekarang jadi kalau mau lihat grafik cari dulu cari reksa dana bisa langsung portofolio meski dulu itu mungkin jadi saat ada ubah fitur anda bisa lihat grafik kembang reksa dana portofolio anda,38,Positif
fitur lupa password berfungsi tidak login password baru padahal sebelumnya berhasil mengganti password menggunakan fitur lupa password dimohon perhatiannya,fitur lupa password fungsi tidak login password baru padahal belum hasil ganti password guna fitur lupa password mohon perhati,-1,Negatif
aplikasinya bagus kekurangannya tidak pembayaran melalui dompet digital dana linkaja gopay kalau ditambah akan lebih menggiurkan investor pemula,aplikasi bagus kurang tidak bayar lalu dompet digital dana linkaja gopay kalau tambah akan lebih giur investor mula,-2,Negatif
pencairan sahamnya memang memakan waktu lama apa beda bank aplikasi dipastikan selesai artinya berhasil terjual saat cek rekening tujuan uangnya sampai hiks cukup khawatir,cair saham memang makan waktu lama apa beda bank aplikasi pasti selesai arti hasil jual saat cek rekening tuju uang sampai hiks cukup khawatir,4,Positif
belum sebagus aplikasi berikutnya terkadang gangguan dana fortopolio terkadang berubah tidak tepat,belum bagus aplikasi ikut terkadang ganggu dana fortopolio terkadang ubah tidak tepat,-7,Negatif
proses pembelian dana reksa dana lama sekali hari namun ada penambahan rekening reksa dana mungkin anda menjualnya itu berharap kedepannya prosesnya memakan waktu hari hingga selesai,proses beli dana reksa dana lama sekali hari namun ada tambah rekening reksa dana mungkin anda jual itu harap depan proses makan waktu hari hingga selesai,20,Positif
mau edit profil aplikasi tiba tiba close admin update aplikasi close terus kalau nanti tambah bintang,mau edit profil aplikasi tiba tiba close admin update aplikasi close terus kalau nanti tambah bintang,-14,Negatif
proses pembelian lama masuk proses penjualan lama masuk mohon diperbaiki sistemnya keduanya saling menguntungkan,proses beli lama masuk proses jual lama masuk mohon baik sistem dua saling untung,-6,Negatif
saran temanteman metode pembayarannya lebih banyak kalau metode pembayaran khusus bareksa tidak ada biaya admin jadi lebih baik aplikasi lainnya,saran temanteman metode bayar lebih banyak kalau metode bayar khusus bareksa tidak ada biaya admin jadi lebih baik aplikasi lain,-8,Negatif
